{
  "$schema": "./magic.schema.json",
  "runes": {
    "an":   [0.832, -0.042, 0.863],
    "be":   [1.011, 0.397, -0.510],
    "vol":  [-0.801, 0.114, 0.887],
    "gi":   [-1.044, -0.348, -0.478],
    "dar":  [0.403, 1.119, -0.163],
    "er":   [-0.491, 1.022, -0.392],
    "zhin": [0.561, -1.001, -0.351],
    "zar":  [-0.275, -1.138, -0.263],
    "im":   [0.209, 0.896, 0.771],
    "kol":  [-0.067, -0.911, 0.778],
    "lun":  [0.301, 0.520, -1.039],
    "mar":  [0.112, -0.357, -1.140]
  },
  "turnAngle": 55.0,
  "stepMultiplier": 1.0,
  "cost": {
    "foodPerRune": 1.0,
    "canKill": false,
    "healthPerFood": 1.0,
    "crystalItem": "gimpanum:crystal_shard",
    "runesPerCrystal": 4
  },
  "cooldownSeconds": 3.0,
  "tabletUpgradeItem": "minecraft:netherite_ingot",
  "limits": {
    "blocksPerSpell": 256,
    "entitiesPerSpell": 16,
    "entityLifetimeSeconds": 120.0,
    "homingEntities": 32,
    "particlesPerTick": 600,
    "defaultTargetRadius": 16.0
  },
  "homing": {
    "searchIntervalTicks": 10,
    "searchRadius": 16.0
  }
}
